,Unnamed: 0,source,review_id,review_date,review_description,rating,user_name,review_title,developer_response,developer_response_date,thumbs_up,laguage_code,country_code
166,1069,App Store,5568fabd-b652-423f-a134-a11b253885e4,2022-08-22,"Normally the app works well but the chat function is not working on my iPhone. Ironically this is due to a message saying how they have made chat easier. You just can’t get rid of it! I rang up last Wednesday and was told it would be fixed by Friday. Ho hum. Why don’t they just take the message down?
It wouldn’t be so bad but when you phone Barclays there’s a 40 minute wait and you are told to use the chat. 
Not impressed…",2,Seanini84,Chat not working,,,,en,gb
167,1071,App Store,c9498bdc-7b2f-4e9b-95e8-204522e8517a,2022-01-31,"Just tried to make a payment. Did not succeed due to time outs, rotating wheel, error messages, having to restart. I tried several times, screen locked not accepting key presses. Kept having to start again and go through the same pointless rigmarole.  Infuriating. Perhaps I should go into my local branch? No, Either closed, on reduced hours or staff who ask why you are there like it is a problem.",2,Bonzo874,Constant error messages,"{'id': 27848230, 'body': 'Hi there. What error codes are you receiving? It may help to go to device settings and navigate to Play Store app and Google Play services app settings and clear cache and then try to update, or try a reinstall of the app. Let us know how you get on. Your Online Banking through the website is also available for any urgent banking needs. Many Thanks. AG', 'modified': '2022-02-04T12:18:54Z'}",,,en,gb
168,1097,App Store,4afb3dc2-70df-481e-9a22-e45c7611c649,2023-03-27,"Everything with the Barclays app is great, with the exception to paying in a cheque. Which really does not work. After at least 10 attempts and doing everything it tells you to do, still nothing. My son tried on his NatWest and it worked straight away, so I think the problem is with the app. Now I have to go n pay it in manually.",3,jacee53,Everything is good,,,,en,gb
169,1098,App Store,04ab7ceb-f82f-4c50-99b5-1e48daceaf42,2023-02-16,"Every time I upgrade the IOS on the SE 2020, it disables the Touch ID in the Barclays Banking app from enabling. I can only get the Touch ID to work is to deleting the app and installing it again. When I do this, I have to use my debit card with a PIN SENTRY device to register to use the app again (the umpteenth time) to identify myself. I'm getting fed up with this; please fix the app so I can enable the Touch ID after an IOS upgrade without the deletion.",2,Manhunter1986,IOS upgrade disables touch ID,,,,en,gb
170,1128,App Store,f85c41fe-c5ba-448e-9ce7-e5ad3d3a3b95,2022-10-26,"The Barclays iOS app has always been flawless - but now crashes when trying to transfer between accounts.  As soon as I select the destination account, the app crashes to the iOS Home Screen

I have reinstalled the app and this still happens every time",3,Mike___F,Crashes when trying to transfer between accounts,,,,en,gb
171,1162,App Store,ebca6e2b-0e81-45c2-9c51-3d6b6cd4a4e7,2022-05-28,"Its okay but can you please fix bugs that mean I have to reload the payment buttons page and make sure the confirm payments button appears ON the Mobile screen and we don’t have to scroll down to find it. This 2 step process means payments don’t get completed, if I’m in a rush and my thumbs are faster than my brain.",3,wwertyyuujjkk,Snagging bugs are appearing,,,,en,gb
172,1177,App Store,a7ec8488-69a0-4279-9b1d-e19832143033,2022-06-27,"Why does the app still store payee information when you ask it not to? Frustrating. You end up having loads of payees clogging up your regular payments. Also you can’t do everything on the App, you have to resort to a laptop or desktop of which I do not have.",4,007RAS,Payments,"{'id': 23587948, 'body': ""Hi. Thanks for reaching out. I will pass this feedback over to our developers for you. Please let us know if there's anything else we can do in the meantime. Thanks. AK"", 'modified': '2021-06-25T13:04:15Z'}",,,en,gb
173,1214,App Store,915f2bfd-3d5c-4a90-957d-1fef93b75560,2022-10-21,I find the information I need easy to access and to use for transfers and other payments. Being an old fashioned banker myself I was always dubious about electronic banking but have found the Barclays app easy to use and very effective.,5,Cayman Dusty,Using Barclays app,,,,en,gb
174,1215,App Store,e2202ab4-a306-4265-a7fe-f88ce5be27e2,2022-04-17,Barclays customer service is 100% better than any other bank I’m glad I choose to move to barlclays is the best thing I did they help you in anyway they can I would highly recommend Barclays to anyone,5,graham2017,Customer service,,,,en,gb
175,1216,App Store,22b98488-2e59-4a30-88cb-502b45c63bfd,2022-08-22,"I’m about to cancel my card with Barclays, and I literally JUST got it. I’ve been waiting on the phone on customer support for basically an hour (55 minutes) and no one has answered. I know you’re short staffed but wow. I only put £2 into my account to use Barclays as a savings account but, I don’t even want it anymore. I want to cancel my card with Barclays and just never return. Customer service wait time is disgusting, wouldn’t recommend to anyone and it’s a waste.",1,yellurrulley,Disgusting,,,,en,gb
176,1217,App Store,8182c5f6-bc49-4aff-886a-ac2b003d7e80,2022-04-20,Great app have used it for years and was perfect until recent update removed the upcoming transactions feature that was ideal to ensure you had an idea of planned payments going out of said accounts. Please bring this back asap to the next update?,4,Mad Maru,Was perfect until latest update,,,,en,gb
177,1218,App Store,52cc4f1c-eefc-45bc-89f1-090bc955c47b,2022-04-04,Been a customer for many years. Online banking has got better and better. Simple and efficient service which offers decent functionality! Probably the best thing Barclays does now.,5,MM011184,Online Banking,,,,en,gb
178,1246,App Store,503cec80-d36c-49a0-b0c2-01cbf130369f,2022-12-22,"I’ve been using the app for years and it has really helped me keep track of my money. I can even check how much I have in my account, in the shop, before I purchase anything. I’ve recommended it to family members.",5,Bobqkazoo,Great app,,,,en,gb
179,1247,App Store,820739bf-656c-4c81-86bf-71015213320e,2023-01-13,"Launchpad offers nothing useful to banking and paying in a cheque is full of bugs. Hard to find camera and too tricky to take an acceptable photo, seems ok but eventually fails and hangs up.  App seems only way to communicate with barclays now apart from twitter which many do not use. Can do some simple things, dont run before u can walk to app techs!",3,Ngwena,OK but limited,,,,en,gb
180,1248,App Store,9338cb80-5d21-4da3-93a0-b01b3bdd1a58,2022-11-11,Simple. Quick and easy to use. Just a shame on line banking kills jobs in branches! But on the plus side more time to do other stuff !,5,nigel66666,"It all works perfectly. That’s all you need from your bank. The branch is now a wine bar, progress?",,,,en,gb
181,1249,App Store,4098b489-3a92-4119-b18a-6e4a17b26d47,2022-04-07,Since the last update i have been unable to save downloaded statements. The statement downloads but when trying to save to files there is no option to actually save,5,Barcasm,Will not download statements,,,,en,gb
182,1272,App Store,5b0306c0-03bb-4460-99b7-553d35795b58,2023-01-31,I have been with Barclays for 40 years and they have always treated me well. I wouldn’t change my bank. They have always supported me.  I bank with the listening bank for my business but they don’t listen so I will be transferring it to barclays,5,moonandmushroom,Mrs E Gavin,,,,en,gb
183,1273,App Store,1ae6e557-7961-41b5-8d2b-9df8aedf09ba,2022-09-30,I am getting immediately logged out when leaving the app even for a moment but in settings I have it selected for 2 minute delay. When trying to give feedback through the app that is also not working as no ‘submit’ button. Please fix,4,scotty30!!,Great app but . . .,,,,en,gb
184,1274,App Store,f383a805-f163-46b4-9282-df8129a6ed5f,2022-03-19,"Please look at the upcoming transactions feature, as it displays incorrect information, from old historical d/d’s, which is misleading.

The transactions obviously don’t go through, however it shows them on the upcoming transactions which it shouldn’t and it is annoying.

Please sort this out in your next update.",3,Leazesmag,Upcoming Transactions Incorrect,"{'id': 28677626, 'body': ""Hi, thanks for your comment. This doesn't sound right at all. Would you be able to get in touch with team on social media who would be happy to look into this for you. Thanks, Nick"", 'modified': '2022-03-20T21:52:44Z'}",,,en,gb
185,1275,App Store,a0f2e902-983c-4a03-8cee-93e2e9a1b76a,2022-08-09,"Chat function is useless. I wanted to cancel a meeting in my branch. Because it is impossible to speak to a human on the phone these days, I stated that I wanted to cancel a meeting and the chat it replied “please rearrange your reply so I can understand”! I gave up, and I refuse to call and hold on the phone for 45 minutes. I will just not turn up, so Barclays have just lost my business did to their pathetic customer service.",2,Fierrabras,Useless App,,,,en,gb
186,1276,App Store,7844ebee-adc4-427b-82cc-e32e453aa0d3,2022-03-23,"I have used this app for years to look after my mother’s finances as I have power of attorney due to dementia. I have recently been told I can no long use it as ‘I am putting her finances at risk’
I now how to go through the rigmarole of setting up new passwords, new cards, new stupid ‘safe’ password gadgets to be used every time I need to view the account.
Talk about stress- I HOPE NONE YOUR EMPLOYEES HAS TO DEAL WITH DEMENTED PARENTS AND BANK BUREAUCRATS.

I only gave you one star because it will not let me write my review and give NO STARS",1,OxfordMum,Totally unhelpful - NO STARS,"{'id': 28782947, 'body': 'Hi there. Sorry to read you are disappointed to know that the app is not available for Power of Attorney customers. As a POA for your mother, you can have access to online and telephone banking and you may also visit branch. Hope this clarifies. AG', 'modified': '2022-03-25T14:19:25Z'}",,,en,gb
187,1308,App Store,b8fc05fb-54fb-4770-a130-7fd5b28963af,2023-03-15,"Have used for years - it’s brilliant everything just works please don’t ever change it..
Paying in a cheque can take a couple of tries but works - (need to get it all in the picture btw) but it’s flawless and I use it daily 😊",5,Fee654,Brilliant !,,,,en,gb
188,1309,App Store,8b36c35b-25c2-4124-bfd8-a6f9bdb64173,2023-04-13,"Years on and you still cant write an app that can effectively scan a cheque ! All the other banks I’m with seems to manage to write their apps effectively. Will be calling into the branch tomorrow so that they can witness just how bad it is. Please dont rely telling me I need to make sure the cheque is on a high contrast surface I’ve just spent 15mins trying on different surfaces to no avail ! Swapped to the HSBC online app scanned first time, you guys really need to find some decent coders.",1,ukrobjohn,Still Impossible to scan a cheque,"{'id': 13937088, 'body': 'I will certainly feed that back :) -Jay ', 'modified': '2020-03-09T10:34:45Z'}",,,en,gb
189,1310,App Store,52ae0db9-e3f7-45d3-bff5-645cf1a569e2,2022-06-24,"Developer AG, not sure when I wrote the face recognition complaint but it’s all working fine now, maybe a glitch in the system that caused me problems but rely on this app as it does everything I need… 
Tnx’s for the email…..",5,Tomcatuk,Back to 100%,"{'id': 30535448, 'body': ""Hi there. What happens when you try to log in with face recognition. Do you get an error message? I'd like to help. Thanks. AG"", 'modified': '2022-06-24T09:18:22Z'}",,,en,gb
190,1311,App Store,e8e9c717-fb10-493b-9a06-fd45ed08cffe,2022-11-28,"Doesn’t always work as it should. 
Apple update seems to have deleted all but 3 of my payees. Thanks for that. 
For the first time in about 5 years I received a cheque today and guess what ? Pay in a cheque won’t work on the App. 10 mile round trip plus parking charges to pay in a cheque. 
30 minute wait to speak to someone on the phone. Chat facility on App totally useless. 
So the App is poor and so is Barclays customer service. 1 star is one too many.",1,Www.Holly123,Ok when it works.,,,,en,gb
191,1312,App Store,6f5b3b14-25da-42fb-b82b-237c32ddff3e,2022-07-11,"There is no option to have pots (like in other modern banks) and a minor but very annoying thing - the app is updated quite often, but in order to do it you have to go to App Store, find it and then update. You could’ve just added a button on a Home Screen that would bring us to that update. Thanks",3,Specccialkey,The app is ok but,"{'id': 30876186, 'body': 'Hi there, thanks for your feedback; I really appreciate your suggestion. I’ll pass this over to our developers for you. Our updates ensure you have access to all the latest features and fixes to enhance your experience, as well as keeping your app secure. Many thanks. RE', 'modified': '2022-07-13T16:53:30Z'}",,,en,gb
192,1314,App Store,2de1eb9b-80db-4503-82aa-c13adb9a0e2e,2022-02-22,"I can no longer use this app since the new IOS update as received an error message saying the app is not supported on jailbroken devices. My iPhone has never been jailbroken and Apple have confirmed this - absolute nightmare not being able to access my accounts through no fault of my own. Barclays support couldn’t help me either, will be changing banks due to this.",2,Lydiapx,My phone is not jailbroken!!!!,"{'id': 28544672, 'body': 'Hi, sorry to hear this. I will pass this feedback onto our developers to make the experience better for you. Thanks, Nick', 'modified': '2022-03-13T20:43:05Z'}",,,en,gb
193,1347,App Store,ec38ee63-9cc0-4554-8b36-9f0c1b94d525,2022-06-09,My only criticism of the App is the amount of times you update your terms and conditions and then expect customers to play ‘spot the changes’ without providing a summary of the changes you’ve brought i..,5,KeithJS1,Barclays App feedback,,,,en,gb
194,1348,App Store,1194b577-ca73-452d-b2f2-ca29dafa3597,2023-04-18,Since the latest update I’m not getting spending notifications either deposit ones. I tried everything included delete and install the app again and nothing changed. Also when we get send money the amount doesn’t change and we need to leave the app and login again to see the updated balance. Please sort them out!!,2,KAvraam,It’s okay,,,,en,gb
195,1349,App Store,49e510b3-6011-4f91-8c09-684deb537898,2023-03-27,"Been using the app for years and it’s fantastic, but the latest update has remixed the above which was on the homepage of this app and the Barclaycard app. Now it’s on neither and as a customer there is no way of tracking monthly and annual spend against the targets you set. Can this be addressed please.",4,James ardron,Removal of AVIOS point/spend tracker,,,,en,gb
196,1350,App Store,d85c0b83-af20-470b-b681-dfc66ba37fba,2023-03-15,"I don't need to log into online banking at all anymore, however, some requests:

1) Show the mortgage balance on the main accounts list, I shouldn’t have to tap to another screen to get the info

2) Allow for dark mode which would be useful for night use 

3) For notifications provide more information, e.g.
£50 received from xyz into account 123 

4) For Barclaycard transactions - instant notifications 

5) Main screen requires a cleaner look, remove all the ads for products and services, makes it look too cluttered",4,equitydealer,Good app but room for improvements,,,,en,gb
197,1351,App Store,f5b733be-3b54-42fd-b89b-c14cb883b9ec,2022-06-16,"I already have the Barclay bank app and I can’t see that this provides anything extra.

It’s supposed to help you if you need customer support for Barclaycard but it’s dreadful. You go round in circles. 

The online robots type information at you at the speed of light. It feels like an assault.  They say they will put you through to a real person to help but it doesn’t happen. Hopeless. You are better off holding on forever on the phone.",1,PennyPost,Hopeless customer support,,,,en,gb
198,1352,App Store,bfd13886-47e9-464c-ba7b-37cafd46df8e,2022-04-04,This app is so easy to use. Only down fall is you can not delete the names of people you’ve transferred money to as I will never need some of them again so I do not see the need for them to be on my recent payee list,5,Craigwiggybennett,My honest review,,,,en,gb
199,1389,App Store,48ecc32f-6da4-43f4-8487-2d87d0763823,2023-02-28,"Have been using the app for years with little problems.
After updating my Phone and reinstalled the app as instructions. Some accounts will no longer show on the app.
1 month of trying to resolve the issue with customer service , still not resolved and been told that it is not possible to view the accounts on the app !!!!!!
Very poor Customer service and very poor app !",1,1amSuperstar123,Very Poor and shockingly bad customer service,,,,en,gb
200,1422,App Store,6591f829-e878-4307-9d3f-bcc193e8aac3,2023-04-01,I was a person who resisted all things technology for the longest time because I feared it. Especially banking. I took the plunge on the Barclays App and now I can’t function without it. It’s liberating doing ‘banking in the move’,5,VonPoggenpoel,It goes everywhere with me,,,,en,gb
201,1423,App Store,5dec3b70-203c-46f4-a9bf-71fc59ad57e6,2022-11-13,I feel so easy to use the app from the start and the periodic information notice gives you alert to stay away from scammer and to be safe from account.,5,aShadow0ps,Easy user interface,,,,en,gb
202,1424,App Store,de40dddd-3937-4d51-a148-90c57fc57367,2023-02-12,"Love the app and don’t have any problems with it. Please add feature to temporarily freeze the credit card Barclaycard for added security and peace of mind when not in use. Currently can only temp freeze the debit card, not credit. Thanks",4,Trixla,Allow Barclaycard credit temporary freeze,,,,en,gb
203,1425,App Store,43ae900a-bb9e-4f96-b17a-d7057e24f540,2022-12-04,"Barclays run many of their services via the app: non-app online services are limited. Setting the app up is very finicky on the ipad, there seems to be an issue in how the app interacts with the camera and the screen display. Then the actual services in the app are also restricted. All in all a thoroughly frustrating experience for very little reward.",2,blubblubblubberdieblubblub,Very finicky to work with limited functionality,,,,en,gb
204,1426,App Store,bc39d8da-7672-443c-a579-271b53b951b5,2022-09-29,"Initially I given 2 rating, I was wrong the app is actually is good and able to do whatever my banking needs. Kudos to the app development team. And I feel the chats accessibility options and response timeline is needs to be improved.",5,smoh.elppa,Nice app!,"{'id': 26078127, 'body': 'Hi there.  We are working on improvements for app speed/responsiveness overall. However, this can be impacted by mobile network or WIFI strength, and low device storage also. Thanks. AG', 'modified': '2021-11-04T11:56:02Z'}",,,en,gb
205,1468,App Store,ffa87d81-2373-4a80-a9d0-6f4f804e1223,2023-02-19,"Just want to say this is best app with production wise I’m always very satisfied an hour I want to transfer money here or there completely feel secure. Really recommend this app and I would like to say thank you Barclay bank, thanks",5,Azhar Chaudhry,Amazing app,,,,en,gb
206,1470,App Store,a7436c58-3b94-4b91-8a3b-83a54dd45f2e,2023-03-08,"I have been using this banking app for a few years now. Since the last update I have not been able to pay in cheques, it will not let me take the photos that are needed. Apart from that I would have given it 5 * s.",4,Chrissyboy 24,Photo problems,,,,en,gb
207,1471,App Store,995f4971-58a8-48a8-8a2e-9f5780752cb0,2022-05-29,A great app. I feel secure and safe when I use this app online. You can keep track of your money. Even let you track your expenses and also save money using the vault. Highly recommend.,5,Jyndette,Safe and secure,,,,en,gb
208,1472,App Store,ddfcb33e-d309-4975-80bb-f1ef7d4759cc,2023-01-18,This app has not been thought thru for mortgage only customers. Taken a week to get registered including a 45 minute phone call wait. They lack the imagination to consider you having a mortgage without their current account. It requires your phone number which is not collected during mortgage application. Does not allow you to make lump sum overpayments or set up recurring DD payments. Virtually pointless and very poorly thought out,1,Pianoman9m,Pulling teeth,,,,en,gb
209,1473,App Store,40ae6a1c-9941-4d85-9385-277b6311fbc1,2022-12-23,"I don’t know who is writing those 5 star reviews, but here is a real one: I tried adding direct debit for my credit card. Every time I switched between apps to check my other bank details, Barcalays app kept resetting the UI like I just opened it. Extremely frustrating. Do you even test your app? Fix it ASAP. The application state should be preserved! It looks like a mobile app written for 20 bucks by some Feverr freelancers. What a shame.",1,Г-н Ходорковский,Worst User Experience,,,,en,gb
210,1516,App Store,12b90467-8545-4b90-97f4-f6e5fe12a5c0,2023-02-26,The app is easy to use and convenient. I like the fact that I get notifications when money comes out of my account . If anything is unusual it’s easy to check when I’m on the go.,5,DeeByp,Convenient,,,,en,gb
211,1517,App Store,16e36f51-88c6-4b0b-aa04-ba771f1464f1,2023-04-20,"I am trying to open an account after fill in few details when I reached Identity check after enter DOB birth the app simple stuck it doesn’t allow me to proceed neither any error message. As customer i have no idea what is going on. It would be great if any helpful message so that customer is aware of the issue. I happy to help if you team wants to get i touch with me. Thanks Nihar

Issue details: 
Time: 10:50am to 10:52am
Device: Apple Mini 12",1,Lifezkl,Not helpful,,,,en,gb
212,1518,App Store,92104d9b-ae8e-49a2-a6b3-71f0c1fb8e15,2023-03-24,"Simple things like:
- for transfer, I have to select the account I need to send from. I only have ONE
- it’s full of failures, I once tried to do a transfer and it said that would take up to 4 hours and if I didn't see it in my transactions I should do again. What the heck?
- fails to face id login often
- short idle time, seconds after I change screen, for example to check another app, it forces me to login again returning to the main page, could at least return to the same screen I was.
- not all the notifications works as it should
- takes hours for a transaction shows in the app letting us confused if it worked or not",2,kaitoqueiroz,Terrible usability,"{'id': 25835058, 'body': 'Hi there. Thank you for providing your feedback. The reason for additional security checks are to protect your account as the details you are referring to are considered high risk. I hope you understand the security we have in place is to protect our customer account to the highest level. Thanks. AG', 'modified': '2021-10-22T14:12:56Z'}",,,en,gb
213,1519,App Store,f5241638-432e-4081-9313-7c9db84ba350,2023-02-26,"For instance - “just tap the pin sentry icon on the app Home Screen” would be great….if only there were a pin sentry icon on the Home Screen. Without it, I cannot log in to online banking - so I end up excluded from everything. Why oh why do developers persist in building half-tested apps.
The actual functions of the rest of the app are fine if you can get to them",2,GrandadGordon,Never as clever as it thinks it is,,,,en,gb
214,1520,App Store,253685e7-de16-4043-951f-55ea6caf07aa,2022-11-24,"I wonder now how I ever used to queue in a bank to do my banking 
In the comfort of your own home any time of day or night 
You can check your balance pay a bill keep an eye on your spending 
Absolutely brilliant",5,Sheily anne,App banking,,,,en,gb
215,1521,App Store,1d0e99dc-8224-4ee2-a450-747755b3cd8c,2023-01-20,Worked fine until today when I can’t seem to access the app without it freezing upon loading or saying it’s able to process my request at the time when I’m using mobile data which is very frustrating as I don’t have access to safe wifi networks all the time !!,2,Shnsmdjenxjdhdhhw,No longer working in mobile data,,,,en,gb
216,1522,App Store,615f2eb3-e1cc-42d4-8fad-62c691a38698,2022-10-17,The one thing I like about the app is that you can get on it moving money around pay bills any time you like and it saves hanging on the phone waiting for Barclay personnel to answer this must be a great saving to Barclays,5,MA11KAT,Save me Time 😊,,,,en,gb
217,1523,App Store,0488bd00-4a1b-4703-b65f-301d09e725e3,2022-11-19,"Overall I’m ok with the app. However, my local branch closed last year. The nearest is now 6 miles away. Could really do with the ability to pay in cheques  with a value over £1000 like other bank apps. Either that or reopen my Branch!",4,Nanchang Man,Cheque value too low,,,,en,gb
218,1524,App Store,707ffc36-7bf6-4594-b307-13d76984872c,2022-02-09,"I have been using the Barclays banking app for some years now and find it so useful. I can make payments by transfer, pay in cheques and check my outgoings at any time of the day or night.",5,DestinyDebs,Online banking,,,,en,gb
219,1554,App Store,29d5f65b-10e1-48c3-8268-f06ba6209de2,2023-01-16,"Improvement over the pin sentry and debit card malarkey. Very easy to check incoming and outgoing items, download statements and pay local or internationally. Works the same when overseas which is where it wins for me.",5,PeckMyHead,Useful,,,,en,gb
